{
  "$schema": "../../../schemas/plugin.schema.json",
  "apiVersion": 1,
  "id": "linkedin",
  "name": "LinkedIn",
  "version": "0.2.0",
  "description": "Read your feed, search posts, people (optionally only your connections), companies and jobs, and read a post or job \u2014 all from what the page has rendered.",
  "matches": [
    "https://linkedin.com/*",
    "https://www.linkedin.com/*"
  ]
}
