{
  "$schema": "../../../schemas/plugin.schema.json",
  "apiVersion": 1,
  "id": "reddit",
  "name": "Reddit",
  "version": "0.3.0",
  "description": "Browse communities, list and read posts, and publish text or link posts.",
  "matches": [
    "https://reddit.com/*",
    "https://www.reddit.com/*",
    "https://old.reddit.com/*",
    "https://new.reddit.com/*"
  ]
}
